
==================================================
=== GitHub Video Generation for: 2026-01-27 ===
Repository: yasufumi-nakata/eegflow

=== Phase 1: Fetching GitHub Activities for yasufumi-nakata/eegflow ===
Fetching GitHub activities for: yasufumi-nakata/eegflow (days_back=1)
Commits: 0
Pull Requests: 0
Issues: 1
Warning: GITHUB_TOKEN required for Discussions API
Discussions: 0
Total activities: 1

=== Phase 2: Generating Script ===
Generating GitHub activity script for yasufumi-nakata/eegflow...
Activities: 1 (PRs: 0, Issues: 1, Discussions: 0)
Attempt 1/3...
Script saved to github_script.json

=== Phase 3: Generating Audio ===
Processing 32 lines of dialogue...
Warning: Could not fetch VOICEVOX speakers: HTTPConnectionPool(host='127.0.0.1', port=50021): Max retries exceeded with url: /speakers (Caused by NewConnectionError('<urllib3.connection.HTTPConnection object at 0x12c9004f0>: Failed to establish a new connection: [Errno 61] Connection refused'))
[1/32] Generating 青山龍星: 2026年1月27日、イーイージーフロー...
Error creating audio query for 青山龍星: HTTPConnectionPool(host='127.0.0.1', port=50021): Max retries exceeded with url: /audio_query?text=2026%E5%B9%B41%E6%9C%8827%E6%97%A5%E3%80%81%E3%82%A4%E3%83%BC%E3%82%A4%E3%83%BC%E3%82%B8%E3%83%BC%E3%83%95%E3%83%AD%E3%83%BC%E9%96%8B%E7%99%BA%E6%97%A5%E8%A8%98%E3%81%B8%E3%82%88%E3%81%86%E3%81%93%E3%81%9D%E3%80%82&speaker=3 (Caused by NewConnectionError('<urllib3.connection.HTTPConnection object at 0x12c900dc0>: Failed to establish a new connection: [Errno 61] Connection refused'))
  -> Failed.
[2/32] Generating 青山龍星: 本日は、GitHubリポジトリで議論され...
Error creating audio query for 青山龍星: HTTPConnectionPool(host='127.0.0.1', port=50021): Max retries exceeded with url: /audio_query?text=%E6%9C%AC%E6%97%A5%E3%81%AF%E3%80%81GitHub%E3%83%AA%E3%83%9D%E3%82%B8%E3%83%88%E3%83%AA%E3%81%A7%E8%AD%B0%E8%AB%96%E3%81%95%E3%82%8C%E3%81%A6%E3%81%84%E3%82%8BIssue+%2352%E3%81%AB%E3%81%A4%E3%81%84%E3%81%A6%E3%81%8A%E8%A9%B1%E3%81%97%E3%81%97%E3%81%BE%E3%81%99%E3%80%82&speaker=3 (Caused by NewConnectionError('<urllib3.connection.HTTPConnection object at 0x12c78ac20>: Failed to establish a new connection: [Errno 61] Connection refused'))
  -> Failed.
[3/32] Generating 青山龍星: このIssueは、WBE（ウェブベースの...
Error creating audio query for 青山龍星: HTTPConnectionPool(host='127.0.0.1', port=50021): Max retries exceeded with url: /audio_query?text=%E3%81%93%E3%81%AEIssue%E3%81%AF%E3%80%81WBE%EF%BC%88%E3%82%A6%E3%82%A7%E3%83%96%E3%83%99%E3%83%BC%E3%82%B9%E3%81%AE%E6%84%8F%E8%AD%98%E3%82%A2%E3%83%83%E3%83%97%E3%83%AD%E3%83%BC%E3%83%89%EF%BC%89%E7%A0%94%E7%A9%B6%E3%81%AB%E3%81%8A%E3%81%91%E3%82%8B%E7%A7%91%E5%AD%A6%E7%9A%84%E5%8E%B3%E5%AF%86%E6%80%A7%E3%82%92%E9%AB%98%E3%82%81%E3%82%8B%E3%81%9F%E3%82%81%E3%81%AE%E6%8F%90%E6%A1%88%E3%81%A7%E3%81%99%E3%80%82&speaker=3 (Caused by NewConnectionError('<urllib3.connection.HTTPConnection object at 0x12c9008e0>: Failed to establish a new connection: [Errno 61] Connection refused'))
  -> Failed.
[4/32] Generating 青山龍星: まず、背景として、eegflow.jpは...
Error creating audio query for 青山龍星: HTTPConnectionPool(host='127.0.0.1', port=50021): Max retries exceeded with url: /audio_query?text=%E3%81%BE%E3%81%9A%E3%80%81%E8%83%8C%E6%99%AF%E3%81%A8%E3%81%97%E3%81%A6%E3%80%81eegflow.jp%E3%81%AFIIT+4.0%E3%82%84FEP%E3%82%B9%E3%83%A9%E3%83%83%E3%82%B7%E3%83%A5Active+Inference%E3%81%A8%E3%81%84%E3%81%A3%E3%81%9F%E6%9C%80%E6%96%B0%E7%90%86%E8%AB%96%E3%82%92%E8%BF%85%E9%80%9F%E3%81%AB%E5%8F%96%E3%82%8A%E5%85%A5%E3%82%8C%E3%81%A6%E3%81%84%E3%81%BE%E3%81%99%E3%80%82&speaker=3 (Caused by NewConnectionError('<urllib3.connection.HTTPConnection object at 0x12c901360>: Failed to establish a new connection: [Errno 61] Connection refused'))
  -> Failed.
[5/32] Generating 青山龍星: しかし、理論を実装に落とし込む過程で科学...
Error creating audio query for 青山龍星: HTTPConnectionPool(host='127.0.0.1', port=50021): Max retries exceeded with url: /audio_query?text=%E3%81%97%E3%81%8B%E3%81%97%E3%80%81%E7%90%86%E8%AB%96%E3%82%92%E5%AE%9F%E8%A3%85%E3%81%AB%E8%90%BD%E3%81%A8%E3%81%97%E8%BE%BC%E3%82%80%E9%81%8E%E7%A8%8B%E3%81%A7%E7%A7%91%E5%AD%A6%E7%9A%84%E5%8E%B3%E5%AF%86%E6%80%A7%E3%81%8C%E6%AC%A0%E3%81%91%E3%82%8B%E7%82%B9%E3%81%8C%E6%8C%87%E6%91%98%E3%81%95%E3%82%8C%E3%81%A6%E3%81%84%E3%81%BE%E3%81%99%E3%80%82&speaker=3 (Caused by NewConnectionError('<urllib3.connection.HTTPConnection object at 0x12c901c30>: Failed to establish a new connection: [Errno 61] Connection refused'))
  -> Failed.
[6/32] Generating 青山龍星: 具体的には、IITの「内因的実在」公理を...
Error creating audio query for 青山龍星: HTTPConnectionPool(host='127.0.0.1', port=50021): Max retries exceeded with url: /audio_query?text=%E5%85%B7%E4%BD%93%E7%9A%84%E3%81%AB%E3%81%AF%E3%80%81IIT%E3%81%AE%E3%80%8C%E5%86%85%E5%9B%A0%E7%9A%84%E5%AE%9F%E5%9C%A8%E3%80%8D%E5%85%AC%E7%90%86%E3%82%92%E5%B7%A5%E5%AD%A6%E7%9A%84%E3%81%AB%E8%BF%91%E4%BC%BC%E3%81%99%E3%82%8B%E9%9A%9B%E3%80%81%E6%A6%82%E5%BF%B5%E7%9A%84%E9%A3%9B%E8%BA%8D%E3%81%8C%E7%94%9F%E3%81%98%E3%81%A6%E3%81%84%E3%82%8B%E3%81%A8%E3%81%95%E3%82%8C%E3%81%A6%E3%81%84%E3%81%BE%E3%81%99%E3%80%82&speaker=3 (Caused by NewConnectionError('<urllib3.connection.HTTPConnection object at 0x12c902500>: Failed to establish a new connection: [Errno 61] Connection refused'))
  -> Failed.
[7/32] Generating 青山龍星: 内因的実在は、システムが自らにとって存在...
Error creating audio query for 青山龍星: HTTPConnectionPool(host='127.0.0.1', port=50021): Max retries exceeded with url: /audio_query?text=%E5%86%85%E5%9B%A0%E7%9A%84%E5%AE%9F%E5%9C%A8%E3%81%AF%E3%80%81%E3%82%B7%E3%82%B9%E3%83%86%E3%83%A0%E3%81%8C%E8%87%AA%E3%82%89%E3%81%AB%E3%81%A8%E3%81%A3%E3%81%A6%E5%AD%98%E5%9C%A8%E3%81%99%E3%82%8B%E3%81%A8%E3%81%84%E3%81%86%E7%8F%BE%E8%B1%A1%E8%AB%96%E7%9A%84%E3%81%AA%E4%B8%BB%E5%BC%B5%E3%81%A7%E3%81%82%E3%82%8A%E3%80%81%E5%9B%A0%E6%9E%9C%E6%A7%8B%E9%80%A0%E3%81%AE%E4%BF%9D%E5%AD%98%E3%81%8C%E9%8D%B5%E3%81%A7%E3%81%99%E3%80%82&speaker=3 (Caused by NewConnectionError('<urllib3.connection.HTTPConnection object at 0x12c78bd00>: Failed to establish a new connection: [Errno 61] Connection refused'))
  -> Failed.
[8/32] Generating 青山龍星: しかし、ウェブサイトではそれを「計算の連...
Error creating audio query for 青山龍星: HTTPConnectionPool(host='127.0.0.1', port=50021): Max retries exceeded with url: /audio_query?text=%E3%81%97%E3%81%8B%E3%81%97%E3%80%81%E3%82%A6%E3%82%A7%E3%83%96%E3%82%B5%E3%82%A4%E3%83%88%E3%81%A7%E3%81%AF%E3%81%9D%E3%82%8C%E3%82%92%E3%80%8C%E8%A8%88%E7%AE%97%E3%81%AE%E9%80%A3%E7%B6%9A%E6%80%A7%E3%80%8D%E3%82%84%E3%80%8C%E7%86%B1%E5%8A%9B%E5%AD%A6%E7%9A%84%E6%95%A3%E9%80%B8%E3%80%8D%E3%81%A8%E7%BD%AE%E3%81%8D%E6%8F%9B%E3%81%88%E3%81%A6%E3%81%84%E3%82%8B%E3%81%9F%E3%82%81%E3%80%81%E7%89%A9%E7%90%86%E7%9A%84%E5%85%AC%E7%90%86%E3%81%B8%E3%81%AE%E6%BC%94%E7%B9%B9%E3%81%8C%E6%96%AD%E3%81%9F%E3%82%8C%E3%81%A6%E3%81%84%E3%81%BE%E3%81%99%E3%80%82&speaker=3 (Caused by NewConnectionError('<urllib3.connection.HTTPConnection object at 0x12c9022f0>: Failed to establish a new connection: [Errno 61] Connection refused'))
  -> Failed.
[9/32] Generating 青山龍星: この点を改善するために、提案では定量的か...
Error creating audio query for 青山龍星: HTTPConnectionPool(host='127.0.0.1', port=50021): Max retries exceeded with url: /audio_query?text=%E3%81%93%E3%81%AE%E7%82%B9%E3%82%92%E6%94%B9%E5%96%84%E3%81%99%E3%82%8B%E3%81%9F%E3%82%81%E3%81%AB%E3%80%81%E6%8F%90%E6%A1%88%E3%81%A7%E3%81%AF%E5%AE%9A%E9%87%8F%E7%9A%84%E3%81%8B%E3%81%A4%E5%8F%8D%E8%A8%BC%E5%8F%AF%E8%83%BD%E3%81%AA%E9%96%BE%E5%80%A4%E3%82%92%E8%A8%AD%E5%AE%9A%E3%81%99%E3%82%8B%E5%BF%85%E8%A6%81%E6%80%A7%E3%81%8C%E6%8C%99%E3%81%92%E3%82%89%E3%82%8C%E3%81%A6%E3%81%84%E3%81%BE%E3%81%99%E3%80%82&speaker=3 (Caused by NewConnectionError('<urllib3.connection.HTTPConnection object at 0x12c901a20>: Failed to establish a new connection: [Errno 61] Connection refused'))
  -> Failed.
[10/32] Generating 青山龍星: 次に、FEP/Active Infere...
Error creating audio query for 青山龍星: HTTPConnectionPool(host='127.0.0.1', port=50021): Max retries exceeded with url: /audio_query?text=%E6%AC%A1%E3%81%AB%E3%80%81FEP%E3%82%B9%E3%83%A9%E3%83%83%E3%82%B7%E3%83%A5Active+Inference%E3%81%AE%E9%81%A9%E7%94%A8%E3%81%AB%E3%81%A4%E3%81%84%E3%81%A6%E3%82%82%E5%90%8C%E6%A7%98%E3%81%AE%E5%95%8F%E9%A1%8C%E3%81%8C%E6%8C%87%E6%91%98%E3%81%95%E3%82%8C%E3%81%A6%E3%81%84%E3%81%BE%E3%81%99%E3%80%82&speaker=3 (Caused by NewConnectionError('<urllib3.connection.HTTPConnection object at 0x12c9001f0>: Failed to establish a new connection: [Errno 61] Connection refused'))
  -> Failed.
[11/32] Generating 青山龍星: FEPは予測誤差最小化という枠組みですが...
Error creating audio query for 青山龍星: HTTPConnectionPool(host='127.0.0.1', port=50021): Max retries exceeded with url: /audio_query?text=FEP%E3%81%AF%E4%BA%88%E6%B8%AC%E8%AA%A4%E5%B7%AE%E6%9C%80%E5%B0%8F%E5%8C%96%E3%81%A8%E3%81%84%E3%81%86%E6%9E%A0%E7%B5%84%E3%81%BF%E3%81%A7%E3%81%99%E3%81%8C%E3%80%81%E5%AE%9F%E9%9A%9B%E3%81%AE%E3%83%87%E3%83%BC%E3%82%BF%E8%A7%A3%E6%9E%90%E3%81%A7%E3%81%A9%E3%81%AE%E7%A8%8B%E5%BA%A6%E4%BA%88%E6%B8%AC%E8%AA%A4%E5%B7%AE%E3%82%92%E6%B8%AC%E5%AE%9A%E3%81%A7%E3%81%8D%E3%82%8B%E3%81%8B%E3%81%8C%E4%B8%8D%E9%80%8F%E6%98%8E%E3%81%A7%E3%81%99%E3%80%82&speaker=3 (Caused by NewConnectionError('<urllib3.connection.HTTPConnection object at 0x12c900cd0>: Failed to establish a new connection: [Errno 61] Connection refused'))
  -> Failed.
[12/32] Generating 青山龍星: 提案では、予測誤差の定量化手法を明示し、...
Error creating audio query for 青山龍星: HTTPConnectionPool(host='127.0.0.1', port=50021): Max retries exceeded with url: /audio_query?text=%E6%8F%90%E6%A1%88%E3%81%A7%E3%81%AF%E3%80%81%E4%BA%88%E6%B8%AC%E8%AA%A4%E5%B7%AE%E3%81%AE%E5%AE%9A%E9%87%8F%E5%8C%96%E6%89%8B%E6%B3%95%E3%82%92%E6%98%8E%E7%A4%BA%E3%81%97%E3%80%81%E5%AE%9F%E9%A8%93%E3%83%87%E3%83%BC%E3%82%BF%E3%81%A8%E3%81%AE%E6%AF%94%E8%BC%83%E5%8F%AF%E8%83%BD%E6%80%A7%E3%82%92%E7%A2%BA%E4%BF%9D%E3%81%99%E3%82%8B%E3%81%93%E3%81%A8%E3%81%8C%E6%B1%82%E3%82%81%E3%82%89%E3%82%8C%E3%81%A6%E3%81%84%E3%81%BE%E3%81%99%E3%80%82&speaker=3 (Caused by NewConnectionError('<urllib3.connection.HTTPConnection object at 0x12c902dd0>: Failed to establish a new connection: [Errno 61] Connection refused'))
  -> Failed.
[13/32] Generating 青山龍星: さらに、Adversarial Coll...
Error creating audio query for 青山龍星: HTTPConnectionPool(host='127.0.0.1', port=50021): Max retries exceeded with url: /audio_query?text=%E3%81%95%E3%82%89%E3%81%AB%E3%80%81Adversarial+Collaboration%E3%81%AE%E6%A6%82%E5%BF%B5%E3%82%82%E5%8F%96%E3%82%8A%E5%85%A5%E3%82%8C%E3%82%89%E3%82%8C%E3%81%A6%E3%81%84%E3%82%8B%E3%82%82%E3%81%AE%E3%81%AE%E3%80%81%E3%81%9D%E3%81%AE%E5%AE%9F%E8%A3%85%E3%81%AB%E3%81%8A%E3%81%91%E3%82%8B%E5%AE%A2%E8%A6%B3%E7%9A%84%E8%A9%95%E4%BE%A1%E5%9F%BA%E6%BA%96%E3%81%8C%E4%B8%8D%E8%B6%B3%E3%81%97%E3%81%A6%E3%81%84%E3%81%BE%E3%81%99%E3%80%82&speaker=3 (Caused by NewConnectionError('<urllib3.connection.HTTPConnection object at 0x12c900970>: Failed to establish a new connection: [Errno 61] Connection refused'))
  -> Failed.
[14/32] Generating 青山龍星: 研究コミュニティ内では、こうした基準を設...
Error creating audio query for 青山龍星: HTTPConnectionPool(host='127.0.0.1', port=50021): Max retries exceeded with url: /audio_query?text=%E7%A0%94%E7%A9%B6%E3%82%B3%E3%83%9F%E3%83%A5%E3%83%8B%E3%83%86%E3%82%A3%E5%86%85%E3%81%A7%E3%81%AF%E3%80%81%E3%81%93%E3%81%86%E3%81%97%E3%81%9F%E5%9F%BA%E6%BA%96%E3%82%92%E8%A8%AD%E3%81%91%E3%82%8B%E3%81%93%E3%81%A8%E3%81%A7%E5%AE%9F%E9%A8%93%E5%86%8D%E7%8F%BE%E6%80%A7%E3%81%8C%E5%90%91%E4%B8%8A%E3%81%99%E3%82%8B%E3%81%A8%E8%AD%B0%E8%AB%96%E3%81%95%E3%82%8C%E3%81%A6%E3%81%84%E3%81%BE%E3%81%99%E3%80%82&speaker=3 (Caused by NewConnectionError('<urllib3.connection.HTTPConnection object at 0x12c901300>: Failed to establish a new connection: [Errno 61] Connection refused'))
  -> Failed.
[15/32] Generating 青山龍星: このIssueの目的は、WBE研究を「閉...
Error creating audio query for 青山龍星: HTTPConnectionPool(host='127.0.0.1', port=50021): Max retries exceeded with url: /audio_query?text=%E3%81%93%E3%81%AEIssue%E3%81%AE%E7%9B%AE%E7%9A%84%E3%81%AF%E3%80%81WBE%E7%A0%94%E7%A9%B6%E3%82%92%E3%80%8C%E9%96%89%E3%83%AB%E3%83%BC%E3%83%97%E5%AE%9F%E8%A3%85%E3%80%8D%E3%83%AC%E3%83%99%E3%83%AB%E3%81%AB%E5%BC%95%E3%81%8D%E4%B8%8A%E3%81%92%E3%82%8B%E3%81%93%E3%81%A8%E3%81%A7%E3%81%99%E3%80%82&speaker=3 (Caused by NewConnectionError('<urllib3.connection.HTTPConnection object at 0x12c901bd0>: Failed to establish a new connection: [Errno 61] Connection refused'))
  -> Failed.
[16/32] Generating 青山龍星: 具体的には、クレーム階段P1からL3へと...
Error creating audio query for 青山龍星: HTTPConnectionPool(host='127.0.0.1', port=50021): Max retries exceeded with url: /audio_query?text=%E5%85%B7%E4%BD%93%E7%9A%84%E3%81%AB%E3%81%AF%E3%80%81%E3%82%AF%E3%83%AC%E3%83%BC%E3%83%A0%E9%9A%8E%E6%AE%B5P1%E3%81%8B%E3%82%89L3%E3%81%B8%E3%81%A8%E3%82%B9%E3%83%86%E3%83%83%E3%83%97%E3%82%A2%E3%83%83%E3%83%97%E3%81%97%E3%80%81%E7%90%86%E8%AB%96%E7%9A%84%E4%B8%BB%E5%BC%B5%E3%81%8C%E5%AE%9F%E9%A8%93%E3%83%87%E3%83%BC%E3%82%BF%E3%81%A7%E8%A3%8F%E4%BB%98%E3%81%91%E3%82%89%E3%82%8C%E3%82%8B%E3%82%88%E3%81%86%E3%81%AB%E3%81%99%E3%82%8B%E3%81%93%E3%81%A8%E3%81%A7%E3%81%99%E3%80%82&speaker=3 (Caused by NewConnectionError('<urllib3.connection.HTTPConnection object at 0x12c9024a0>: Failed to establish a new connection: [Errno 61] Connection refused'))
  -> Failed.
[17/32] Generating 青山龍星: 提案された改善策には、因果構造の保存を測...
Error creating audio query for 青山龍星: HTTPConnectionPool(host='127.0.0.1', port=50021): Max retries exceeded with url: /audio_query?text=%E6%8F%90%E6%A1%88%E3%81%95%E3%82%8C%E3%81%9F%E6%94%B9%E5%96%84%E7%AD%96%E3%81%AB%E3%81%AF%E3%80%81%E5%9B%A0%E6%9E%9C%E6%A7%8B%E9%80%A0%E3%81%AE%E4%BF%9D%E5%AD%98%E3%82%92%E6%B8%AC%E5%AE%9A%E3%81%99%E3%82%8B%E6%96%B0%E3%81%97%E3%81%84%E3%82%A2%E3%83%AB%E3%82%B4%E3%83%AA%E3%82%BA%E3%83%A0%E3%82%84%E3%80%81%E8%A8%88%E7%AE%97%E9%80%A3%E7%B6%9A%E6%80%A7%E3%81%AE%E7%B2%92%E5%BA%A6%E3%82%92%E5%8F%AF%E8%A6%96%E5%8C%96%E3%81%99%E3%82%8B%E3%83%84%E3%83%BC%E3%83%AB%E3%81%8C%E5%90%AB%E3%81%BE%E3%82%8C%E3%81%A6%E3%81%84%E3%81%BE%E3%81%99%E3%80%82&speaker=3 (Caused by NewConnectionError('<urllib3.connection.HTTPConnection object at 0x12c9026e0>: Failed to establish a new connection: [Errno 61] Connection refused'))
  -> Failed.
[18/32] Generating 青山龍星: これらはすべて、EEGデータの解析方法を...
Error creating audio query for 青山龍星: HTTPConnectionPool(host='127.0.0.1', port=50021): Max retries exceeded with url: /audio_query?text=%E3%81%93%E3%82%8C%E3%82%89%E3%81%AF%E3%81%99%E3%81%B9%E3%81%A6%E3%80%81%E3%82%A4%E3%83%BC%E3%82%A4%E3%83%BC%E3%82%B8%E3%83%BC%E3%83%87%E3%83%BC%E3%82%BF%E3%81%AE%E8%A7%A3%E6%9E%90%E6%96%B9%E6%B3%95%E3%82%92%E9%80%B2%E5%8C%96%E3%81%95%E3%81%9B%E3%82%8B%E3%81%9F%E3%82%81%E3%81%AB%E8%A8%AD%E8%A8%88%E3%81%95%E3%82%8C%E3%81%A6%E3%81%84%E3%81%BE%E3%81%99%E3%80%82&speaker=3 (Caused by NewConnectionError('<urllib3.connection.HTTPConnection object at 0x12c78bf70>: Failed to establish a new connection: [Errno 61] Connection refused'))
  -> Failed.
[19/32] Generating 青山龍星: 例えば、脳波信号の時間分解能を高めること...
Error creating audio query for 青山龍星: HTTPConnectionPool(host='127.0.0.1', port=50021): Max retries exceeded with url: /audio_query?text=%E4%BE%8B%E3%81%88%E3%81%B0%E3%80%81%E8%84%B3%E6%B3%A2%E4%BF%A1%E5%8F%B7%E3%81%AE%E6%99%82%E9%96%93%E5%88%86%E8%A7%A3%E8%83%BD%E3%82%92%E9%AB%98%E3%82%81%E3%82%8B%E3%81%93%E3%81%A8%E3%81%A7%E3%80%81%E8%A8%88%E7%AE%97%E9%80%A3%E7%B6%9A%E6%80%A7%E3%81%8C%E7%A0%B4%E7%B6%BB%E3%81%99%E3%82%8B%E7%9E%AC%E9%96%93%E3%82%92%E6%A4%9C%E5%87%BA%E3%81%A7%E3%81%8D%E3%82%8B%E3%82%88%E3%81%86%E3%81%AB%E3%81%AA%E3%82%8B%E5%8F%AF%E8%83%BD%E6%80%A7%E3%81%8C%E3%81%82%E3%82%8A%E3%81%BE%E3%81%99%E3%80%82&speaker=3 (Caused by NewConnectionError('<urllib3.connection.HTTPConnection object at 0x12c9027a0>: Failed to establish a new connection: [Errno 61] Connection refused'))
  -> Failed.
[20/32] Generating 青山龍星: また、予測誤差をリアルタイムで算出し、フ...
Error creating audio query for 青山龍星: HTTPConnectionPool(host='127.0.0.1', port=50021): Max retries exceeded with url: /audio_query?text=%E3%81%BE%E3%81%9F%E3%80%81%E4%BA%88%E6%B8%AC%E8%AA%A4%E5%B7%AE%E3%82%92%E3%83%AA%E3%82%A2%E3%83%AB%E3%82%BF%E3%82%A4%E3%83%A0%E3%81%A7%E7%AE%97%E5%87%BA%E3%81%97%E3%80%81%E3%83%95%E3%82%A3%E3%83%BC%E3%83%89%E3%83%90%E3%83%83%E3%82%AF%E3%81%A8%E3%81%97%E3%81%A6%E8%84%B3%E6%B3%A2%E3%81%AB%E5%8F%8D%E6%98%A0%E3%81%95%E3%81%9B%E3%82%8B%E3%81%93%E3%81%A8%E3%81%A7%E3%80%81%E3%82%A2%E3%82%AF%E3%83%86%E3%82%A3%E3%83%96%E3%83%BB%E3%82%A4%E3%83%B3%E3%83%95%E3%82%A7%E3%83%AC%E3%83%B3%E3%82%B9%E3%81%AE%E5%AE%9F%E8%A8%BC%E3%81%8C%E6%9C%9F%E5%BE%85%E3%81%95%E3%82%8C%E3%81%BE%E3%81%99%E3%80%82&speaker=3 (Caused by NewConnectionError('<urllib3.connection.HTTPConnection object at 0x12c901e40>: Failed to establish a new connection: [Errno 61] Connection refused'))
  -> Failed.
[21/32] Generating 青山龍星: こうした手法は、従来の静的解析から動的解...
Error creating audio query for 青山龍星: HTTPConnectionPool(host='127.0.0.1', port=50021): Max retries exceeded with url: /audio_query?text=%E3%81%93%E3%81%86%E3%81%97%E3%81%9F%E6%89%8B%E6%B3%95%E3%81%AF%E3%80%81%E5%BE%93%E6%9D%A5%E3%81%AE%E9%9D%99%E7%9A%84%E8%A7%A3%E6%9E%90%E3%81%8B%E3%82%89%E5%8B%95%E7%9A%84%E8%A7%A3%E6%9E%90%E3%81%B8%E3%81%A8%E3%82%B7%E3%83%95%E3%83%88%E3%81%99%E3%82%8B%E5%A4%A7%E3%81%8D%E3%81%AA%E4%B8%80%E6%AD%A9%E3%81%A7%E3%81%99%E3%80%82&speaker=3 (Caused by NewConnectionError('<urllib3.connection.HTTPConnection object at 0x12c901690>: Failed to establish a new connection: [Errno 61] Connection refused'))
  -> Failed.
[22/32] Generating 青山龍星: しかし、課題も残ります。...
Error creating audio query for 青山龍星: HTTPConnectionPool(host='127.0.0.1', port=50021): Max retries exceeded with url: /audio_query?text=%E3%81%97%E3%81%8B%E3%81%97%E3%80%81%E8%AA%B2%E9%A1%8C%E3%82%82%E6%AE%8B%E3%82%8A%E3%81%BE%E3%81%99%E3%80%82&speaker=3 (Caused by NewConnectionError('<urllib3.connection.HTTPConnection object at 0x12c900430>: Failed to establish a new connection: [Errno 61] Connection refused'))
  -> Failed.
[23/32] Generating 青山龍星: まず、データ量が膨大になるため、計算コス...
Error creating audio query for 青山龍星: HTTPConnectionPool(host='127.0.0.1', port=50021): Max retries exceeded with url: /audio_query?text=%E3%81%BE%E3%81%9A%E3%80%81%E3%83%87%E3%83%BC%E3%82%BF%E9%87%8F%E3%81%8C%E8%86%A8%E5%A4%A7%E3%81%AB%E3%81%AA%E3%82%8B%E3%81%9F%E3%82%81%E3%80%81%E8%A8%88%E7%AE%97%E3%82%B3%E3%82%B9%E3%83%88%E3%81%A8%E3%83%AA%E3%82%A2%E3%83%AB%E3%82%BF%E3%82%A4%E3%83%A0%E6%80%A7%E3%81%AE%E3%83%90%E3%83%A9%E3%83%B3%E3%82%B9%E3%82%92%E3%81%A9%E3%81%86%E5%8F%96%E3%82%8B%E3%81%8B%E3%81%8C%E9%87%8D%E8%A6%81%E3%81%A7%E3%81%99%E3%80%82&speaker=3 (Caused by NewConnectionError('<urllib3.connection.HTTPConnection object at 0x12c901060>: Failed to establish a new connection: [Errno 61] Connection refused'))
  -> Failed.
[24/32] Generating 青山龍星: 次に、理論的枠組みと実装の間で生じる解釈...
Error creating audio query for 青山龍星: HTTPConnectionPool(host='127.0.0.1', port=50021): Max retries exceeded with url: /audio_query?text=%E6%AC%A1%E3%81%AB%E3%80%81%E7%90%86%E8%AB%96%E7%9A%84%E6%9E%A0%E7%B5%84%E3%81%BF%E3%81%A8%E5%AE%9F%E8%A3%85%E3%81%AE%E9%96%93%E3%81%A7%E7%94%9F%E3%81%98%E3%82%8B%E8%A7%A3%E9%87%88%E3%82%AE%E3%83%A3%E3%83%83%E3%83%97%E3%82%92%E3%81%A9%E3%81%86%E5%9F%8B%E3%82%81%E3%82%8B%E3%81%8B%E3%81%8C%E8%AD%B0%E8%AB%96%E3%81%AE%E7%84%A6%E7%82%B9%E3%81%A7%E3%81%99%E3%80%82&speaker=3 (Caused by NewConnectionError('<urllib3.connection.HTTPConnection object at 0x12c9017e0>: Failed to establish a new connection: [Errno 61] Connection refused'))
  -> Failed.
[25/32] Generating 青山龍星: コミュニティでは、こうした課題に対してオ...
Error creating audio query for 青山龍星: HTTPConnectionPool(host='127.0.0.1', port=50021): Max retries exceeded with url: /audio_query?text=%E3%82%B3%E3%83%9F%E3%83%A5%E3%83%8B%E3%83%86%E3%82%A3%E3%81%A7%E3%81%AF%E3%80%81%E3%81%93%E3%81%86%E3%81%97%E3%81%9F%E8%AA%B2%E9%A1%8C%E3%81%AB%E5%AF%BE%E3%81%97%E3%81%A6%E3%82%AA%E3%83%BC%E3%83%97%E3%83%B3%E3%81%AA%E3%83%87%E3%82%A3%E3%82%B9%E3%82%AB%E3%83%83%E3%82%B7%E3%83%A7%E3%83%B3%E3%81%8C%E8%A1%8C%E3%82%8F%E3%82%8C%E3%81%A6%E3%81%8A%E3%82%8A%E3%80%81%E6%8F%90%E6%A1%88%E3%81%AE%E5%AE%9F%E8%A3%85%E3%81%AB%E5%AF%BE%E3%81%99%E3%82%8B%E3%83%95%E3%82%A3%E3%83%BC%E3%83%89%E3%83%90%E3%83%83%E3%82%AF%E3%82%82%E7%A9%8D%E6%A5%B5%E7%9A%84%E3%81%A7%E3%81%99%E3%80%82&speaker=3 (Caused by NewConnectionError('<urllib3.connection.HTTPConnection object at 0x12c9020b0>: Failed to establish a new connection: [Errno 61] Connection refused'))
  -> Failed.
[26/32] Generating 青山龍星: 今後は、実験データと理論モデルを統合する...
Error creating audio query for 青山龍星: HTTPConnectionPool(host='127.0.0.1', port=50021): Max retries exceeded with url: /audio_query?text=%E4%BB%8A%E5%BE%8C%E3%81%AF%E3%80%81%E5%AE%9F%E9%A8%93%E3%83%87%E3%83%BC%E3%82%BF%E3%81%A8%E7%90%86%E8%AB%96%E3%83%A2%E3%83%87%E3%83%AB%E3%82%92%E7%B5%B1%E5%90%88%E3%81%99%E3%82%8B%E3%81%9F%E3%82%81%E3%81%AE%E5%85%B1%E9%80%9A%E3%83%95%E3%83%AC%E3%83%BC%E3%83%A0%E3%83%AF%E3%83%BC%E3%82%AF%E3%81%8C%E9%96%8B%E7%99%BA%E3%81%95%E3%82%8C%E3%82%8B%E8%A6%8B%E8%BE%BC%E3%81%BF%E3%81%A7%E3%81%99%E3%80%82&speaker=3 (Caused by NewConnectionError('<urllib3.connection.HTTPConnection object at 0x12c9019c0>: Failed to establish a new connection: [Errno 61] Connection refused'))
  -> Failed.
[27/32] Generating 青山龍星: このフレームワークは、IITとFEPを同...
Error creating audio query for 青山龍星: HTTPConnectionPool(host='127.0.0.1', port=50021): Max retries exceeded with url: /audio_query?text=%E3%81%93%E3%81%AE%E3%83%95%E3%83%AC%E3%83%BC%E3%83%A0%E3%83%AF%E3%83%BC%E3%82%AF%E3%81%AF%E3%80%81IIT%E3%81%A8FEP%E3%82%92%E5%90%8C%E6%99%82%E3%81%AB%E6%89%B1%E3%81%88%E3%82%8B%E3%82%88%E3%81%86%E8%A8%AD%E8%A8%88%E3%81%95%E3%82%8C%E3%81%A6%E3%81%8A%E3%82%8A%E3%80%81%E8%A4%87%E5%90%88%E7%9A%84%E3%81%AA%E6%84%8F%E8%AD%98%E3%83%A2%E3%83%87%E3%83%AB%E3%81%AE%E6%A4%9C%E8%A8%BC%E3%81%8C%E5%8F%AF%E8%83%BD%E3%81%AB%E3%81%AA%E3%82%8A%E3%81%BE%E3%81%99%E3%80%82&speaker=3 (Caused by NewConnectionError('<urllib3.connection.HTTPConnection object at 0x12c903400>: Failed to establish a new connection: [Errno 61] Connection refused'))
  -> Failed.
[28/32] Generating 青山龍星: さらに、Adversarial Coll...
Error creating audio query for 青山龍星: HTTPConnectionPool(host='127.0.0.1', port=50021): Max retries exceeded with url: /audio_query?text=%E3%81%95%E3%82%89%E3%81%AB%E3%80%81Adversarial+Collaboration%E3%81%AE%E6%89%8B%E6%B3%95%E3%82%92%E7%B5%84%E3%81%BF%E8%BE%BC%E3%82%80%E3%81%93%E3%81%A8%E3%81%A7%E3%80%81%E7%95%B0%E3%81%AA%E3%82%8B%E7%A0%94%E7%A9%B6%E8%80%85%E9%96%93%E3%81%A7%E3%83%87%E3%83%BC%E3%82%BF%E3%81%A8%E3%83%A2%E3%83%87%E3%83%AB%E3%82%92%E5%85%B1%E6%9C%89%E3%81%97%E3%80%81%E5%AE%A2%E8%A6%B3%E7%9A%84%E8%A9%95%E4%BE%A1%E3%81%8C%E8%A1%8C%E3%81%88%E3%82%8B%E7%92%B0%E5%A2%83%E3%81%8C%E6%95%B4%E3%81%86%E3%81%A7%E3%81%97%E3%82%87%E3%81%86%E3%80%82&speaker=3 (Caused by NewConnectionError('<urllib3.connection.HTTPConnection object at 0x12c9033a0>: Failed to establish a new connection: [Errno 61] Connection refused'))
  -> Failed.
[29/32] Generating 青山龍星: まとめとして、Issue #52はWBE...
Error creating audio query for 青山龍星: HTTPConnectionPool(host='127.0.0.1', port=50021): Max retries exceeded with url: /audio_query?text=%E3%81%BE%E3%81%A8%E3%82%81%E3%81%A8%E3%81%97%E3%81%A6%E3%80%81Issue+%2352%E3%81%AFWBE%E7%A0%94%E7%A9%B6%E3%81%AB%E3%81%8A%E3%81%91%E3%82%8B%E7%90%86%E8%AB%96%E3%81%A8%E5%AE%9F%E8%A3%85%E3%81%AE%E3%82%AE%E3%83%A3%E3%83%83%E3%83%97%E3%82%92%E5%9F%8B%E3%82%81%E3%80%81%E7%A7%91%E5%AD%A6%E7%9A%84%E5%8E%B3%E5%AF%86%E6%80%A7%E3%82%92%E9%AB%98%E3%82%81%E3%82%8B%E9%87%8D%E8%A6%81%E3%81%AA%E3%82%B9%E3%83%86%E3%83%83%E3%83%97%E3%81%A7%E3%81%99%E3%80%82&speaker=3 (Caused by NewConnectionError('<urllib3.connection.HTTPConnection object at 0x12c78ba30>: Failed to establish a new connection: [Errno 61] Connection refused'))
  -> Failed.
[30/32] Generating 青山龍星: 今後の進展が期待される分野であり、研究者...
Error creating audio query for 青山龍星: HTTPConnectionPool(host='127.0.0.1', port=50021): Max retries exceeded with url: /audio_query?text=%E4%BB%8A%E5%BE%8C%E3%81%AE%E9%80%B2%E5%B1%95%E3%81%8C%E6%9C%9F%E5%BE%85%E3%81%95%E3%82%8C%E3%82%8B%E5%88%86%E9%87%8E%E3%81%A7%E3%81%82%E3%82%8A%E3%80%81%E7%A0%94%E7%A9%B6%E8%80%85%E3%81%AE%E3%81%BF%E3%81%AA%E3%82%89%E3%81%9A%E8%81%B4%E8%A1%86%E3%81%AE%E7%9A%86%E3%81%95%E3%81%BE%E3%81%AB%E3%82%82%E6%B3%A8%E7%9B%AE%E3%81%97%E3%81%A6%E3%81%84%E3%81%9F%E3%81%A0%E3%81%8D%E3%81%9F%E3%81%84%E3%83%86%E3%83%BC%E3%83%9E%E3%81%A7%E3%81%99%E3%80%82&speaker=3 (Caused by NewConnectionError('<urllib3.connection.HTTPConnection object at 0x12c903220>: Failed to establish a new connection: [Errno 61] Connection refused'))
  -> Failed.
[31/32] Generating 青山龍星: 次回は、具体的なEEG解析アルゴリズムの...
Error creating audio query for 青山龍星: HTTPConnectionPool(host='127.0.0.1', port=50021): Max retries exceeded with url: /audio_query?text=%E6%AC%A1%E5%9B%9E%E3%81%AF%E3%80%81%E5%85%B7%E4%BD%93%E7%9A%84%E3%81%AA%E3%82%A4%E3%83%BC%E3%82%A4%E3%83%BC%E3%82%B8%E3%83%BC%E8%A7%A3%E6%9E%90%E3%82%A2%E3%83%AB%E3%82%B4%E3%83%AA%E3%82%BA%E3%83%A0%E3%81%AE%E9%80%B2%E5%8C%96%E3%81%AB%E3%81%A4%E3%81%84%E3%81%A6%E6%8E%98%E3%82%8A%E4%B8%8B%E3%81%92%E3%81%A6%E3%81%84%E3%81%8D%E3%81%BE%E3%81%99%E3%80%82&speaker=3 (Caused by NewConnectionError('<urllib3.connection.HTTPConnection object at 0x12c902170>: Failed to establish a new connection: [Errno 61] Connection refused'))
  -> Failed.
[32/32] Generating 青山龍星: それでは、また次回お会いしましょう。...
Error creating audio query for 青山龍星: HTTPConnectionPool(host='127.0.0.1', port=50021): Max retries exceeded with url: /audio_query?text=%E3%81%9D%E3%82%8C%E3%81%A7%E3%81%AF%E3%80%81%E3%81%BE%E3%81%9F%E6%AC%A1%E5%9B%9E%E3%81%8A%E4%BC%9A%E3%81%84%E3%81%97%E3%81%BE%E3%81%97%E3%82%87%E3%81%86%E3%80%82&speaker=3 (Caused by NewConnectionError('<urllib3.connection.HTTPConnection object at 0x12c901900>: Failed to establish a new connection: [Errno 61] Connection refused'))
  -> Failed.

Audio generation complete!
Failed to generate audio.
